{"decision":"accepted","format":"uarch-evidence-review/1","independent":true,"rationale":"No real evidence.","review_hash":"sha256:ccc06f28c7fa515a47d6346e7cad7e34e653bedd1fdfba132e3092096155248e","reviewed_subject_hashes":["sha256:19fccb570118e411d3a93343b13584c076249dc90cf07b6fb508f7331d64d8a0"],"reviewer":"synthetic loader test"}
